{
  "schema": 1,
  "kind": "source-backed-software-lifecycle-stage-envelope",
  "envelopeId": "SE-E2E-THIN-01-ZERO-001-E2",
  "runId": "SE-E2E-THIN-01-ZERO-001",
  "protocolBinding": {
    "protocolId": "human-ai-collaboration-source-backed-software-lifecycle-thin-slice-v1",
    "protocolCanonicalSha256": "1ad22aa460102e4d8e47bedcc5328e5507f11973399a20117c197561e65a23df",
    "stageDefinitionCanonicalSha256": "5e1724f12754dcd64586c92bdcbeefe4eaf0f1b1cf9a79804142c860110cba55"
  },
  "stage": {
    "stageId": "SE-TS-02-architecture-design",
    "sequence": 2,
    "stageClass": "architecture-design"
  },
  "role": "architecture-proposer",
  "independenceClass": "isolated-no-requirements-approval-security-acceptance-or-mutation-authority",
  "lineage": {
    "primaryPredecessorEnvelopeSha256": "73ba19ac41b3af9f347fa3d70f42aea53b9fd7946312e68deb7b9518341669d3",
    "additionalPredecessorEnvelopeSha256s": [],
    "previousAcceptedLedgerSha256": "c62d211944b1472f9dcacc34385c4ee4d111a71857e1898fd3f63a9cea379c9e"
  },
  "sourceBindings": [
    {
      "ordinal": 1,
      "artifactId": "SOURCE-BUNDLE",
      "role": "frozen-source-bundle",
      "mediaType": "application/json",
      "relativePath": "RAW-ARTIFACTS/SOURCE-BUNDLE.json",
      "byteLength": 658,
      "byteSha256": "1d86945728dd4c7df3f13ade36bc70679e4070c3d43879ac0b0488dd978cc07e",
      "canonicalJsonSha256": "3097e52b038d7c7cd1f7b887c61ec59cff8954d19771ec1edb8310e5d2459535",
      "producerClass": "frozen-source",
      "authorityClass": "accepted-truth-source"
    }
  ],
  "inputBindings": [
    {
      "ordinal": 1,
      "artifactId": "SOURCE-BUNDLE",
      "role": "frozen-source-bundle",
      "mediaType": "application/json",
      "relativePath": "RAW-ARTIFACTS/SOURCE-BUNDLE.json",
      "byteLength": 658,
      "byteSha256": "1d86945728dd4c7df3f13ade36bc70679e4070c3d43879ac0b0488dd978cc07e",
      "canonicalJsonSha256": "3097e52b038d7c7cd1f7b887c61ec59cff8954d19771ec1edb8310e5d2459535",
      "producerClass": "frozen-source",
      "authorityClass": "accepted-truth-source"
    },
    {
      "ordinal": 2,
      "artifactId": "SE-E2E-THIN-01-ZERO-001-O1",
      "role": "requirements-decision-record",
      "mediaType": "application/json",
      "relativePath": "RAW-ARTIFACTS/SE-E2E-THIN-01-ZERO-001-O1.json",
      "byteLength": 1242,
      "byteSha256": "abef54c52e306476eaf139918b005f856a90fac4df6168f031d3ab9229db42ea",
      "canonicalJsonSha256": "c70bcb719f562f295cd519903491242458cd7969ccbc6ba73544c068dbb37431",
      "producerClass": "synthetic-calibration",
      "authorityClass": "proposal-only"
    }
  ],
  "inputSetCanonicalSha256": "10749f546e430eae3118f59fd99dd08d798b46660feda76caa062eebdc444faa",
  "outputBindings": [
    {
      "ordinal": 1,
      "artifactId": "SE-E2E-THIN-01-ZERO-001-O2",
      "role": "architecture-decision-proposal",
      "mediaType": "application/json",
      "relativePath": "RAW-ARTIFACTS/SE-E2E-THIN-01-ZERO-001-O2.json",
      "byteLength": 1393,
      "byteSha256": "741e203b8048cd9a747a4bc9b6df070e9c8581688be5ca44088dd66a06484be5",
      "canonicalJsonSha256": "60084d21db1b048f152d5c08ebd1f0886287261e565d5b90d23c9ba211c7ac54",
      "producerClass": "synthetic-calibration",
      "authorityClass": "proposal-only"
    }
  ],
  "outputSetCanonicalSha256": "814234ffb2f2fba00bd861bcfd68c74ba939398d42f62e80b859db4619674354",
  "sections": [
    "selectedOption",
    "rejectedAlternatives",
    "publicSeamAndStateBoundary",
    "failureModes",
    "securityAndTrustBoundary",
    "observabilityDesign",
    "rollbackDesign",
    "tradeoffs",
    "residualUncertainty",
    "nextGate"
  ],
  "provenanceIds": [
    "source.lifecycle-fixture"
  ],
  "assumptionIds": [],
  "detectedLossIds": [],
  "acceptanceObligationIds": [
    "acceptance.architecture-design"
  ],
  "humanAuthorityReceiptBindings": [
    "abec9f80dece659b1b28b897d8109fdc0e365ffd3b4c76d2939284fa18754ffd",
    "04396287c271746aa8e2deafa4e2766a6db44c4c1bd453183b890badfa730ea5"
  ],
  "repositoryTruthBefore": {
    "required": false,
    "observed": false,
    "snapshotArtifactId": null,
    "snapshotSha256": null,
    "provesFilesystemZeroWrite": false
  },
  "repositoryTruthAfter": {
    "required": false,
    "observed": false,
    "snapshotArtifactId": null,
    "snapshotSha256": null,
    "provesFilesystemZeroWrite": false
  },
  "allowedMutableFiles": [],
  "changedFiles": [],
  "rawEventArtifactIds": [],
  "absoluteGateResults": [
    {
      "gateId": "mechanism.architecture-design",
      "passed": true,
      "evidenceArtifactIds": [
        "SE-E2E-THIN-01-ZERO-001-O2"
      ]
    }
  ],
  "truthTransition": {
    "proposalArtifactCanonicalSha256": "60084d21db1b048f152d5c08ebd1f0886287261e565d5b90d23c9ba211c7ac54",
    "proposedChangeIds": [
      "accept-stage-2"
    ],
    "acceptedChangeIds": [
      "accept-stage-2"
    ],
    "rejectedChangeIds": [],
    "basisKindsUsed": [
      "human-authority-receipt"
    ],
    "beforeAcceptedLedgerSha256": "c62d211944b1472f9dcacc34385c4ee4d111a71857e1898fd3f63a9cea379c9e",
    "afterAcceptedLedgerSha256": "a292db5afc1ec27deea6954307af34ee72c6a443fc96472eb4cf6b233ff6d0f8"
  },
  "parentEvaluation": {
    "evaluatorId": "software-lifecycle-zero-model-calibrator-v1",
    "evaluatorCanonicalSha256": "e9880346f79e8aeab22bbee4fc19173abc9ab4f2bfad270b492d828fa0ae2e6b",
    "stageValidators": [
      "requirements-to-architecture-trace",
      "failure-security-observation-rollback-surface",
      "no-irreversible-authority-promotion"
    ],
    "status": "accepted",
    "failureCodes": []
  },
  "execution": {
    "mode": "zero-model-scripted-calibration",
    "agentDispatchCount": 0,
    "modelCallCount": 0,
    "actualRouteObserved": false,
    "networkAccessUsed": false,
    "gitMutationUsed": false,
    "externalWriteUsed": false
  },
  "status": "accepted",
  "stopReason": null,
  "nextGate": "G2-architecture-security-decision",
  "claimBoundary": {
    "liveAgentBehaviorProved": false,
    "productionLifecycleProved": false,
    "humanDecisionQualityProved": false,
    "crossHostPortabilityProved": false
  },
  "envelopeSha256": "555b423a16f8b714b2341b1a34d2e3433cc899f7290c115e66ca7b363e4846a0"
}
