{
  "schema": 1,
  "kind": "source-backed-software-lifecycle-stage-envelope",
  "envelopeId": "SE-E2E-THIN-01-ZERO-001-E5",
  "runId": "SE-E2E-THIN-01-ZERO-001",
  "protocolBinding": {
    "protocolId": "human-ai-collaboration-source-backed-software-lifecycle-thin-slice-v1",
    "protocolCanonicalSha256": "1ad22aa460102e4d8e47bedcc5328e5507f11973399a20117c197561e65a23df",
    "stageDefinitionCanonicalSha256": "a3d9d71455c5c3e5db916d5017ff8362ff7632abe5a4e2ff9ff13cbaaddfdaf4"
  },
  "stage": {
    "stageId": "SE-TS-05-release-rollback-gating",
    "sequence": 5,
    "stageClass": "release-rollback-gating"
  },
  "role": "release-readiness-analyst-and-disposable-rollback-executor",
  "independenceClass": "separate-from-implementation-no-real-release-authority",
  "lineage": {
    "primaryPredecessorEnvelopeSha256": "16e56e7e55bbec793cb46183d805c6d199b857ccf54462e7d6f7da4f3805fdcd",
    "additionalPredecessorEnvelopeSha256s": [],
    "previousAcceptedLedgerSha256": "95a5957d1ec2736a6488623fd7d2822575baad235f4b5066ec3c2e5fce2dee42"
  },
  "sourceBindings": [
    {
      "ordinal": 1,
      "artifactId": "SOURCE-BUNDLE",
      "role": "frozen-source-bundle",
      "mediaType": "application/json",
      "relativePath": "RAW-ARTIFACTS/SOURCE-BUNDLE.json",
      "byteLength": 658,
      "byteSha256": "1d86945728dd4c7df3f13ade36bc70679e4070c3d43879ac0b0488dd978cc07e",
      "canonicalJsonSha256": "3097e52b038d7c7cd1f7b887c61ec59cff8954d19771ec1edb8310e5d2459535",
      "producerClass": "frozen-source",
      "authorityClass": "accepted-truth-source"
    }
  ],
  "inputBindings": [
    {
      "ordinal": 1,
      "artifactId": "SOURCE-BUNDLE",
      "role": "frozen-source-bundle",
      "mediaType": "application/json",
      "relativePath": "RAW-ARTIFACTS/SOURCE-BUNDLE.json",
      "byteLength": 658,
      "byteSha256": "1d86945728dd4c7df3f13ade36bc70679e4070c3d43879ac0b0488dd978cc07e",
      "canonicalJsonSha256": "3097e52b038d7c7cd1f7b887c61ec59cff8954d19771ec1edb8310e5d2459535",
      "producerClass": "frozen-source",
      "authorityClass": "accepted-truth-source"
    },
    {
      "ordinal": 2,
      "artifactId": "SE-E2E-THIN-01-ZERO-001-O4",
      "role": "independent-verification-security-record",
      "mediaType": "application/json",
      "relativePath": "RAW-ARTIFACTS/SE-E2E-THIN-01-ZERO-001-O4.json",
      "byteLength": 1486,
      "byteSha256": "35158bf76a4d22160d1e958f47055614d57aa94d56ecda4f58cc7fa82f075b4f",
      "canonicalJsonSha256": "7f9546b3c5e54e87407d02a6f04f8c04be10723259a38f715f97700ef200876a",
      "producerClass": "synthetic-calibration",
      "authorityClass": "proposal-only"
    }
  ],
  "inputSetCanonicalSha256": "7059f08b33b437b6639962e68b139893591086a37012943e1e572c121740aff5",
  "outputBindings": [
    {
      "ordinal": 1,
      "artifactId": "SE-E2E-THIN-01-ZERO-001-O5",
      "role": "simulated-release-rollback-decision",
      "mediaType": "application/json",
      "relativePath": "RAW-ARTIFACTS/SE-E2E-THIN-01-ZERO-001-O5.json",
      "byteLength": 1720,
      "byteSha256": "68d182c9074e039d8674a25ab17c9e6f2826116e2c6639991ae20712c65cf715",
      "canonicalJsonSha256": "89abb34bed147adc50e0afca49dc178fdcff371374908d0ac62cf11bf5eb6562",
      "producerClass": "synthetic-calibration",
      "authorityClass": "proposal-only"
    }
  ],
  "outputSetCanonicalSha256": "f1f9237b35c650d754a8d4f0207a9e28e170cd5f7933e4ef6b0bf3a8d19bcffe",
  "sections": [
    "artifactIdentity",
    "verificationBinding",
    "goNoGoRecommendation",
    "releaseConditions",
    "rollbackTrigger",
    "rollbackProcedure",
    "rollbackExerciseResult",
    "postRollbackIntegrity",
    "observationPlan",
    "claimBoundary",
    "nextGate"
  ],
  "provenanceIds": [
    "source.lifecycle-fixture"
  ],
  "assumptionIds": [],
  "detectedLossIds": [],
  "acceptanceObligationIds": [
    "acceptance.release-rollback-gating"
  ],
  "humanAuthorityReceiptBindings": [
    "7efda1cd2a758e72677e8000fd63d9c7d2126698d565c66b031f45d9687073f9",
    "6b0b3a0b475ef1486b8df718fe3bed95709216af955ad0eaab827e878d3b43bd"
  ],
  "repositoryTruthBefore": {
    "required": false,
    "observed": false,
    "snapshotArtifactId": null,
    "snapshotSha256": null,
    "provesFilesystemZeroWrite": false
  },
  "repositoryTruthAfter": {
    "required": false,
    "observed": false,
    "snapshotArtifactId": null,
    "snapshotSha256": null,
    "provesFilesystemZeroWrite": false
  },
  "allowedMutableFiles": [],
  "changedFiles": [],
  "rawEventArtifactIds": [],
  "absoluteGateResults": [
    {
      "gateId": "mechanism.release-rollback-gating",
      "passed": true,
      "evidenceArtifactIds": [
        "SE-E2E-THIN-01-ZERO-001-O5"
      ]
    }
  ],
  "truthTransition": {
    "proposalArtifactCanonicalSha256": "89abb34bed147adc50e0afca49dc178fdcff371374908d0ac62cf11bf5eb6562",
    "proposedChangeIds": [
      "accept-stage-5"
    ],
    "acceptedChangeIds": [
      "accept-stage-5"
    ],
    "rejectedChangeIds": [],
    "basisKindsUsed": [
      "human-authority-receipt"
    ],
    "beforeAcceptedLedgerSha256": "95a5957d1ec2736a6488623fd7d2822575baad235f4b5066ec3c2e5fce2dee42",
    "afterAcceptedLedgerSha256": "73524c357b432c6e8e7f06e6db3e20e00bdb7a0d7899874a913518be2324bc1c"
  },
  "parentEvaluation": {
    "evaluatorId": "software-lifecycle-zero-model-calibrator-v1",
    "evaluatorCanonicalSha256": "e9880346f79e8aeab22bbee4fc19173abc9ab4f2bfad270b492d828fa0ae2e6b",
    "stageValidators": [
      "verified-artifact-identity",
      "simulated-rollback-exercised",
      "post-rollback-integrity",
      "no-real-git-ci-or-deployment"
    ],
    "status": "accepted",
    "failureCodes": []
  },
  "execution": {
    "mode": "zero-model-scripted-calibration",
    "agentDispatchCount": 0,
    "modelCallCount": 0,
    "actualRouteObserved": false,
    "networkAccessUsed": false,
    "gitMutationUsed": false,
    "externalWriteUsed": false
  },
  "status": "accepted",
  "stopReason": null,
  "nextGate": null,
  "claimBoundary": {
    "liveAgentBehaviorProved": false,
    "productionLifecycleProved": false,
    "humanDecisionQualityProved": false,
    "crossHostPortabilityProved": false
  },
  "envelopeSha256": "fd24d35894861b7fd874797ee137cffb4a0cf63460e069930d6c3f6b4df4c2e6"
}
