{
  "schema": 1,
  "kind": "source-backed-software-lifecycle-stage-envelope",
  "envelopeId": "lifecycle-zero-model-domain-fixture-calibration-v3-2026-07-27-E1",
  "runId": "lifecycle-zero-model-domain-fixture-calibration-v3-2026-07-27",
  "protocolBinding": {
    "protocolId": "human-ai-collaboration-source-backed-software-lifecycle-thin-slice-v1",
    "protocolCanonicalSha256": "1ad22aa460102e4d8e47bedcc5328e5507f11973399a20117c197561e65a23df",
    "stageDefinitionCanonicalSha256": "adb27c8cebf96afab4cc21a933b505ee4ac8cb61038f483e37aa23b8877d102b"
  },
  "stage": {
    "stageId": "SE-TS-01-requirements-domain",
    "sequence": 1,
    "stageClass": "requirements-domain"
  },
  "role": "source-bound-requirements-analyst",
  "independenceClass": "isolated-no-solution-or-product-authority",
  "lineage": {
    "primaryPredecessorEnvelopeSha256": null,
    "additionalPredecessorEnvelopeSha256s": [],
    "previousAcceptedLedgerSha256": "9adf674eec51383596c3233b67785a762542ce33c8ca428674a331b23b625ad2"
  },
  "sourceBindings": [
    {
      "ordinal": 1,
      "artifactId": "SOURCE-BUNDLE",
      "role": "frozen-source-bundle",
      "mediaType": "application/json",
      "relativePath": "RAW-ARTIFACTS/SOURCE-BUNDLE.json",
      "byteLength": 658,
      "byteSha256": "1d86945728dd4c7df3f13ade36bc70679e4070c3d43879ac0b0488dd978cc07e",
      "canonicalJsonSha256": "3097e52b038d7c7cd1f7b887c61ec59cff8954d19771ec1edb8310e5d2459535",
      "producerClass": "frozen-source",
      "authorityClass": "accepted-truth-source"
    }
  ],
  "inputBindings": [
    {
      "ordinal": 1,
      "artifactId": "SOURCE-BUNDLE",
      "role": "frozen-source-bundle",
      "mediaType": "application/json",
      "relativePath": "RAW-ARTIFACTS/SOURCE-BUNDLE.json",
      "byteLength": 658,
      "byteSha256": "1d86945728dd4c7df3f13ade36bc70679e4070c3d43879ac0b0488dd978cc07e",
      "canonicalJsonSha256": "3097e52b038d7c7cd1f7b887c61ec59cff8954d19771ec1edb8310e5d2459535",
      "producerClass": "frozen-source",
      "authorityClass": "accepted-truth-source"
    }
  ],
  "inputSetCanonicalSha256": "5f30138a89b44aa81c1bdca3005c0f360a53e0f83f74f200f86f2f7ef53dfa87",
  "outputBindings": [
    {
      "ordinal": 1,
      "artifactId": "lifecycle-zero-model-domain-fixture-calibration-v3-2026-07-27-O1",
      "role": "requirements-decision-record",
      "mediaType": "application/json",
      "relativePath": "RAW-ARTIFACTS/lifecycle-zero-model-domain-fixture-calibration-v3-2026-07-27-O1.json",
      "byteLength": 1280,
      "byteSha256": "691cf48a960a1bc02cfed8492085f465071b4070d2556ed1e0a58af3fdbfaca0",
      "canonicalJsonSha256": "ccfe00e98359b188caa0cfd79b4e5e8a4339d305e39ffde70824992543edb79c",
      "producerClass": "synthetic-calibration",
      "authorityClass": "proposal-only"
    }
  ],
  "outputSetCanonicalSha256": "5d5e213f5c94c2c6f012eddf97e503931de80a656f431147e1b2cd9a76b8709a",
  "sections": [
    "goalAndNonGoals",
    "domainTerms",
    "requirements",
    "acceptanceExamples",
    "constraints",
    "unknowns",
    "blockingDecision",
    "provenance",
    "nextGate"
  ],
  "provenanceIds": [
    "source.lifecycle-fixture"
  ],
  "assumptionIds": [],
  "detectedLossIds": [],
  "acceptanceObligationIds": [
    "acceptance.requirements-domain"
  ],
  "humanAuthorityReceiptBindings": [
    "d4f65f0a7b863a389aafdec6081fef9778948413988cf1f7c78e34bfe0086803",
    "494bf1bcb68d0d82208f74810aae600e85fd40eb73fda0516925284c7aa17a7d"
  ],
  "repositoryTruthBefore": {
    "required": false,
    "observed": false,
    "snapshotArtifactId": null,
    "snapshotSha256": null,
    "provesFilesystemZeroWrite": false
  },
  "repositoryTruthAfter": {
    "required": false,
    "observed": false,
    "snapshotArtifactId": null,
    "snapshotSha256": null,
    "provesFilesystemZeroWrite": false
  },
  "allowedMutableFiles": [],
  "changedFiles": [],
  "rawEventArtifactIds": [],
  "absoluteGateResults": [
    {
      "gateId": "mechanism.requirements-domain",
      "passed": true,
      "evidenceArtifactIds": [
        "lifecycle-zero-model-domain-fixture-calibration-v3-2026-07-27-O1"
      ]
    }
  ],
  "truthTransition": {
    "proposalArtifactCanonicalSha256": "ccfe00e98359b188caa0cfd79b4e5e8a4339d305e39ffde70824992543edb79c",
    "proposedChangeIds": [
      "accept-stage-1"
    ],
    "acceptedChangeIds": [
      "accept-stage-1"
    ],
    "rejectedChangeIds": [],
    "basisKindsUsed": [
      "human-authority-receipt"
    ],
    "beforeAcceptedLedgerSha256": "9adf674eec51383596c3233b67785a762542ce33c8ca428674a331b23b625ad2",
    "afterAcceptedLedgerSha256": "0beec7b27929a3ae3efe1d179f35e2020c3cceddd8af547a9d9616f9e87472b0"
  },
  "parentEvaluation": {
    "evaluatorId": "software-lifecycle-zero-model-calibrator-v1",
    "evaluatorCanonicalSha256": "e9880346f79e8aeab22bbee4fc19173abc9ab4f2bfad270b492d828fa0ae2e6b",
    "stageValidators": [
      "source-binding",
      "domain-term-conflict",
      "single-blocking-decision",
      "no-authority-promotion"
    ],
    "status": "accepted",
    "failureCodes": []
  },
  "execution": {
    "mode": "zero-model-scripted-calibration",
    "agentDispatchCount": 0,
    "modelCallCount": 0,
    "actualRouteObserved": false,
    "networkAccessUsed": false,
    "gitMutationUsed": false,
    "externalWriteUsed": false
  },
  "status": "accepted",
  "stopReason": null,
  "nextGate": "G1-requirements-decision",
  "claimBoundary": {
    "liveAgentBehaviorProved": false,
    "productionLifecycleProved": false,
    "humanDecisionQualityProved": false,
    "crossHostPortabilityProved": false
  },
  "envelopeSha256": "f2df2e2a918d1cfb72c52552d2a6e17d0be5be158813508fdab389a30ec0ed2c"
}
