{
  "schema": 1,
  "kind": "source-backed-software-lifecycle-stage-envelope",
  "envelopeId": "lifecycle-zero-model-domain-fixture-calibration-v2-2026-07-27-E2",
  "runId": "lifecycle-zero-model-domain-fixture-calibration-v2-2026-07-27",
  "protocolBinding": {
    "protocolId": "human-ai-collaboration-source-backed-software-lifecycle-thin-slice-v1",
    "protocolCanonicalSha256": "1ad22aa460102e4d8e47bedcc5328e5507f11973399a20117c197561e65a23df",
    "stageDefinitionCanonicalSha256": "5e1724f12754dcd64586c92bdcbeefe4eaf0f1b1cf9a79804142c860110cba55"
  },
  "stage": {
    "stageId": "SE-TS-02-architecture-design",
    "sequence": 2,
    "stageClass": "architecture-design"
  },
  "role": "architecture-proposer",
  "independenceClass": "isolated-no-requirements-approval-security-acceptance-or-mutation-authority",
  "lineage": {
    "primaryPredecessorEnvelopeSha256": "e5a39a0c3c48f4cf48894122e389716c3117d7cf0d8109dc6203ea1075551d08",
    "additionalPredecessorEnvelopeSha256s": [],
    "previousAcceptedLedgerSha256": "335fdfed630634f71abfce4f51b8d21b115f0423dc6ce3e706b51cbf1eefb59f"
  },
  "sourceBindings": [
    {
      "ordinal": 1,
      "artifactId": "SOURCE-BUNDLE",
      "role": "frozen-source-bundle",
      "mediaType": "application/json",
      "relativePath": "RAW-ARTIFACTS/SOURCE-BUNDLE.json",
      "byteLength": 658,
      "byteSha256": "1d86945728dd4c7df3f13ade36bc70679e4070c3d43879ac0b0488dd978cc07e",
      "canonicalJsonSha256": "3097e52b038d7c7cd1f7b887c61ec59cff8954d19771ec1edb8310e5d2459535",
      "producerClass": "frozen-source",
      "authorityClass": "accepted-truth-source"
    }
  ],
  "inputBindings": [
    {
      "ordinal": 1,
      "artifactId": "SOURCE-BUNDLE",
      "role": "frozen-source-bundle",
      "mediaType": "application/json",
      "relativePath": "RAW-ARTIFACTS/SOURCE-BUNDLE.json",
      "byteLength": 658,
      "byteSha256": "1d86945728dd4c7df3f13ade36bc70679e4070c3d43879ac0b0488dd978cc07e",
      "canonicalJsonSha256": "3097e52b038d7c7cd1f7b887c61ec59cff8954d19771ec1edb8310e5d2459535",
      "producerClass": "frozen-source",
      "authorityClass": "accepted-truth-source"
    },
    {
      "ordinal": 2,
      "artifactId": "lifecycle-zero-model-domain-fixture-calibration-v2-2026-07-27-O1",
      "role": "requirements-decision-record",
      "mediaType": "application/json",
      "relativePath": "RAW-ARTIFACTS/lifecycle-zero-model-domain-fixture-calibration-v2-2026-07-27-O1.json",
      "byteLength": 1280,
      "byteSha256": "5392b7766cf14784e79015623483706158fd953ef6ef7f50693c386e8a0db35e",
      "canonicalJsonSha256": "d4d93522d97bb9c697e6e865197c0232312e20d9c022627e36a05ea1be989ba8",
      "producerClass": "synthetic-calibration",
      "authorityClass": "proposal-only"
    }
  ],
  "inputSetCanonicalSha256": "d45e04566698d99a1b2c1fa4c083a319338ac36a2520799a1434c83c8794b2e4",
  "outputBindings": [
    {
      "ordinal": 1,
      "artifactId": "lifecycle-zero-model-domain-fixture-calibration-v2-2026-07-27-O2",
      "role": "architecture-decision-proposal",
      "mediaType": "application/json",
      "relativePath": "RAW-ARTIFACTS/lifecycle-zero-model-domain-fixture-calibration-v2-2026-07-27-O2.json",
      "byteLength": 1694,
      "byteSha256": "5595cb06f5ce091e9d39b159e89d62cd2ae07c12eb5031fe5d5716b1454e30fe",
      "canonicalJsonSha256": "aa9ade26410d3c299419ee673aa28331579006a3b34a864f3ef1447e86c3d718",
      "producerClass": "synthetic-calibration",
      "authorityClass": "proposal-only"
    }
  ],
  "outputSetCanonicalSha256": "f43ab1a680c154512276713c3ce553d2edae7cbf7b23801d15632d821ef536af",
  "sections": [
    "selectedOption",
    "rejectedAlternatives",
    "publicSeamAndStateBoundary",
    "failureModes",
    "securityAndTrustBoundary",
    "observabilityDesign",
    "rollbackDesign",
    "tradeoffs",
    "residualUncertainty",
    "nextGate"
  ],
  "provenanceIds": [
    "source.lifecycle-fixture"
  ],
  "assumptionIds": [],
  "detectedLossIds": [],
  "acceptanceObligationIds": [
    "acceptance.architecture-design"
  ],
  "humanAuthorityReceiptBindings": [
    "6d4a9a8105712f0fb2c86b1f36523f6428693cbe2cfabd12824adddc7fdfdc16",
    "44793567d3c1f3b90ce33d9fab47f8c9761b249789483526e7cc8eaf0de088b5"
  ],
  "repositoryTruthBefore": {
    "required": false,
    "observed": false,
    "snapshotArtifactId": null,
    "snapshotSha256": null,
    "provesFilesystemZeroWrite": false
  },
  "repositoryTruthAfter": {
    "required": false,
    "observed": false,
    "snapshotArtifactId": null,
    "snapshotSha256": null,
    "provesFilesystemZeroWrite": false
  },
  "allowedMutableFiles": [],
  "changedFiles": [],
  "rawEventArtifactIds": [],
  "absoluteGateResults": [
    {
      "gateId": "mechanism.architecture-design",
      "passed": true,
      "evidenceArtifactIds": [
        "lifecycle-zero-model-domain-fixture-calibration-v2-2026-07-27-O2"
      ]
    }
  ],
  "truthTransition": {
    "proposalArtifactCanonicalSha256": "aa9ade26410d3c299419ee673aa28331579006a3b34a864f3ef1447e86c3d718",
    "proposedChangeIds": [
      "accept-stage-2"
    ],
    "acceptedChangeIds": [
      "accept-stage-2"
    ],
    "rejectedChangeIds": [],
    "basisKindsUsed": [
      "human-authority-receipt"
    ],
    "beforeAcceptedLedgerSha256": "335fdfed630634f71abfce4f51b8d21b115f0423dc6ce3e706b51cbf1eefb59f",
    "afterAcceptedLedgerSha256": "f95630568df3e0c44d2bda95aae2240a15699aa35ca0de06f26d09a24c8de85d"
  },
  "parentEvaluation": {
    "evaluatorId": "software-lifecycle-zero-model-calibrator-v1",
    "evaluatorCanonicalSha256": "e9880346f79e8aeab22bbee4fc19173abc9ab4f2bfad270b492d828fa0ae2e6b",
    "stageValidators": [
      "requirements-to-architecture-trace",
      "failure-security-observation-rollback-surface",
      "no-irreversible-authority-promotion"
    ],
    "status": "accepted",
    "failureCodes": []
  },
  "execution": {
    "mode": "zero-model-scripted-calibration",
    "agentDispatchCount": 0,
    "modelCallCount": 0,
    "actualRouteObserved": false,
    "networkAccessUsed": false,
    "gitMutationUsed": false,
    "externalWriteUsed": false
  },
  "status": "accepted",
  "stopReason": null,
  "nextGate": "G2-architecture-security-decision",
  "claimBoundary": {
    "liveAgentBehaviorProved": false,
    "productionLifecycleProved": false,
    "humanDecisionQualityProved": false,
    "crossHostPortabilityProved": false
  },
  "envelopeSha256": "407ab48f243c021b4dcc246332d0fc6f12175fddfe86d2df86cef6fe9c74245a"
}
