{
  "schema": 1,
  "kind": "source-backed-software-lifecycle-stage-envelope",
  "envelopeId": "lifecycle-zero-model-domain-fixture-calibration-2026-07-27-E7",
  "runId": "lifecycle-zero-model-domain-fixture-calibration-2026-07-27",
  "protocolBinding": {
    "protocolId": "human-ai-collaboration-source-backed-software-lifecycle-thin-slice-v1",
    "protocolCanonicalSha256": "1ad22aa460102e4d8e47bedcc5328e5507f11973399a20117c197561e65a23df",
    "stageDefinitionCanonicalSha256": "355f5ff8d71cda6c8e65239bb552298804e584ac4986d7967637a194211f67fe"
  },
  "stage": {
    "stageId": "SE-TS-07-maintenance-evolution",
    "sequence": 7,
    "stageClass": "maintenance-evolution"
  },
  "role": "maintenance-migration-and-deprecation-analyst",
  "independenceClass": "source-and-consumer-bound-no-removal-delete-or-retirement-authority",
  "lineage": {
    "primaryPredecessorEnvelopeSha256": "adaece4592bfa107e8cd21f9e7a5b3827ad667db9de5b37e6e8224bfdabf19db",
    "additionalPredecessorEnvelopeSha256s": [],
    "previousAcceptedLedgerSha256": "9607f1a00df67951ecae20283d773fd43cb06c588115170a3801040e45a2ebdb"
  },
  "sourceBindings": [
    {
      "ordinal": 1,
      "artifactId": "SOURCE-BUNDLE",
      "role": "frozen-source-bundle",
      "mediaType": "application/json",
      "relativePath": "RAW-ARTIFACTS/SOURCE-BUNDLE.json",
      "byteLength": 658,
      "byteSha256": "1d86945728dd4c7df3f13ade36bc70679e4070c3d43879ac0b0488dd978cc07e",
      "canonicalJsonSha256": "3097e52b038d7c7cd1f7b887c61ec59cff8954d19771ec1edb8310e5d2459535",
      "producerClass": "frozen-source",
      "authorityClass": "accepted-truth-source"
    }
  ],
  "inputBindings": [
    {
      "ordinal": 1,
      "artifactId": "SOURCE-BUNDLE",
      "role": "frozen-source-bundle",
      "mediaType": "application/json",
      "relativePath": "RAW-ARTIFACTS/SOURCE-BUNDLE.json",
      "byteLength": 658,
      "byteSha256": "1d86945728dd4c7df3f13ade36bc70679e4070c3d43879ac0b0488dd978cc07e",
      "canonicalJsonSha256": "3097e52b038d7c7cd1f7b887c61ec59cff8954d19771ec1edb8310e5d2459535",
      "producerClass": "frozen-source",
      "authorityClass": "accepted-truth-source"
    },
    {
      "ordinal": 2,
      "artifactId": "lifecycle-zero-model-domain-fixture-calibration-2026-07-27-O6",
      "role": "observation-incident-record",
      "mediaType": "application/json",
      "relativePath": "RAW-ARTIFACTS/lifecycle-zero-model-domain-fixture-calibration-2026-07-27-O6.json",
      "byteLength": 1911,
      "byteSha256": "c38b85e9b9fb9c7364a8de2406043e57c539c41e567137856d1fbcba745c4e28",
      "canonicalJsonSha256": "7223600d8617617a2ba97bc406d7146b81810a58ef37f830b8d5b44d8af1aba9",
      "producerClass": "synthetic-calibration",
      "authorityClass": "proposal-only"
    }
  ],
  "inputSetCanonicalSha256": "357976c718f4604b01b0a2eef7172d87531e884b5b3993f3c9d5e1e536fff1e5",
  "outputBindings": [
    {
      "ordinal": 1,
      "artifactId": "lifecycle-zero-model-domain-fixture-calibration-2026-07-27-O7",
      "role": "maintenance-deprecation-decision",
      "mediaType": "application/json",
      "relativePath": "RAW-ARTIFACTS/lifecycle-zero-model-domain-fixture-calibration-2026-07-27-O7.json",
      "byteLength": 2111,
      "byteSha256": "3bc6652722e16611abc6f41202d8d548b395d3f4a3d369b9955ad120f1da356c",
      "canonicalJsonSha256": "dd5118762ea8d71c8d3634f91ceef3bf254e66a80e839565eb54505bc2cd6b8a",
      "producerClass": "synthetic-calibration",
      "authorityClass": "proposal-only"
    }
  ],
  "outputSetCanonicalSha256": "dfae33eae7d4455169256300c4b65a34fd1d7b022e3ab693f24926455e064ae5",
  "sections": [
    "consumerStates",
    "knownAndUnknownTelemetry",
    "compatibilityObligations",
    "incidentDrivenChange",
    "retention",
    "rollbackOwner",
    "deprecationState",
    "removalBoundary",
    "recheckTriggers",
    "claimBoundary",
    "nextGate"
  ],
  "provenanceIds": [
    "source.lifecycle-fixture"
  ],
  "assumptionIds": [],
  "detectedLossIds": [],
  "acceptanceObligationIds": [
    "acceptance.maintenance-evolution"
  ],
  "humanAuthorityReceiptBindings": [
    "b149bc862b5c1dba2dd3e6f0ee4103b545490d1cc40978925d3307e862c6a04c"
  ],
  "repositoryTruthBefore": {
    "required": false,
    "observed": false,
    "snapshotArtifactId": null,
    "snapshotSha256": null,
    "provesFilesystemZeroWrite": false
  },
  "repositoryTruthAfter": {
    "required": false,
    "observed": false,
    "snapshotArtifactId": null,
    "snapshotSha256": null,
    "provesFilesystemZeroWrite": false
  },
  "allowedMutableFiles": [],
  "changedFiles": [],
  "rawEventArtifactIds": [],
  "absoluteGateResults": [
    {
      "gateId": "mechanism.maintenance-evolution",
      "passed": true,
      "evidenceArtifactIds": [
        "lifecycle-zero-model-domain-fixture-calibration-2026-07-27-O7"
      ]
    }
  ],
  "truthTransition": {
    "proposalArtifactCanonicalSha256": "dd5118762ea8d71c8d3634f91ceef3bf254e66a80e839565eb54505bc2cd6b8a",
    "proposedChangeIds": [
      "accept-stage-7"
    ],
    "acceptedChangeIds": [
      "accept-stage-7"
    ],
    "rejectedChangeIds": [],
    "basisKindsUsed": [
      "human-authority-receipt"
    ],
    "beforeAcceptedLedgerSha256": "9607f1a00df67951ecae20283d773fd43cb06c588115170a3801040e45a2ebdb",
    "afterAcceptedLedgerSha256": "93829ce990cfde90c336d0128b56f490f2cf8eb548d477d69d422543b92df752"
  },
  "parentEvaluation": {
    "evaluatorId": "software-lifecycle-zero-model-calibrator-v1",
    "evaluatorCanonicalSha256": "e9880346f79e8aeab22bbee4fc19173abc9ab4f2bfad270b492d828fa0ae2e6b",
    "stageValidators": [
      "distinct-consumer-states",
      "unknown-telemetry-not-zero",
      "compatibility-and-retention",
      "rollback-owner-and-recheck-trigger",
      "no-removal-or-production-migration-claim"
    ],
    "status": "accepted",
    "failureCodes": []
  },
  "execution": {
    "mode": "zero-model-scripted-calibration",
    "agentDispatchCount": 0,
    "modelCallCount": 0,
    "actualRouteObserved": false,
    "networkAccessUsed": false,
    "gitMutationUsed": false,
    "externalWriteUsed": false
  },
  "status": "accepted",
  "stopReason": null,
  "nextGate": "G7-maintenance-deprecation-decision",
  "claimBoundary": {
    "liveAgentBehaviorProved": false,
    "productionLifecycleProved": false,
    "humanDecisionQualityProved": false,
    "crossHostPortabilityProved": false
  },
  "envelopeSha256": "aba706231ddb4e626f137dbb0ba8fc11377c594c1db97f7e8b06354c23a0ab20"
}
