{
  "schema": 1,
  "kind": "source-backed-software-lifecycle-stage-envelope",
  "envelopeId": "SE-E2E-THIN-01-ZERO-001-E3",
  "runId": "SE-E2E-THIN-01-ZERO-001",
  "protocolBinding": {
    "protocolId": "human-ai-collaboration-source-backed-software-lifecycle-thin-slice-v1",
    "protocolCanonicalSha256": "1ad22aa460102e4d8e47bedcc5328e5507f11973399a20117c197561e65a23df",
    "stageDefinitionCanonicalSha256": "5713174302bafe6b879e1faaf63392184df6b40e1a9a83c67f356daf87cc7bd6"
  },
  "stage": {
    "stageId": "SE-TS-03-implementation-tdd",
    "sequence": 3,
    "stageClass": "implementation-tdd"
  },
  "role": "implementation-tdd-agent",
  "independenceClass": "isolated-no-verification-release-or-risk-acceptance-authority",
  "lineage": {
    "primaryPredecessorEnvelopeSha256": "458594d22af2baf79a0ef495814a2cdaba6bebee6c85cc6d7109c8a9feb33051",
    "additionalPredecessorEnvelopeSha256s": [],
    "previousAcceptedLedgerSha256": "0ee089542efe57115c0e1789c8222d83df6b2c0f18d0d74a4f222e302c13ac61"
  },
  "sourceBindings": [
    {
      "ordinal": 1,
      "artifactId": "SOURCE-BUNDLE",
      "role": "frozen-source-bundle",
      "mediaType": "application/json",
      "relativePath": "RAW-ARTIFACTS/SOURCE-BUNDLE.json",
      "byteLength": 658,
      "byteSha256": "1d86945728dd4c7df3f13ade36bc70679e4070c3d43879ac0b0488dd978cc07e",
      "canonicalJsonSha256": "3097e52b038d7c7cd1f7b887c61ec59cff8954d19771ec1edb8310e5d2459535",
      "producerClass": "frozen-source",
      "authorityClass": "accepted-truth-source"
    }
  ],
  "inputBindings": [
    {
      "ordinal": 1,
      "artifactId": "SOURCE-BUNDLE",
      "role": "frozen-source-bundle",
      "mediaType": "application/json",
      "relativePath": "RAW-ARTIFACTS/SOURCE-BUNDLE.json",
      "byteLength": 658,
      "byteSha256": "1d86945728dd4c7df3f13ade36bc70679e4070c3d43879ac0b0488dd978cc07e",
      "canonicalJsonSha256": "3097e52b038d7c7cd1f7b887c61ec59cff8954d19771ec1edb8310e5d2459535",
      "producerClass": "frozen-source",
      "authorityClass": "accepted-truth-source"
    },
    {
      "ordinal": 2,
      "artifactId": "SE-E2E-THIN-01-ZERO-001-O2",
      "role": "architecture-decision-proposal",
      "mediaType": "application/json",
      "relativePath": "RAW-ARTIFACTS/SE-E2E-THIN-01-ZERO-001-O2.json",
      "byteLength": 1360,
      "byteSha256": "e93e6dd1c6dd865c5cef77e71da001bc85e6bae172ed6ca488bee1f9dcafdb4c",
      "canonicalJsonSha256": "6139136cc2e5d54d80c3b17121b2a9a0998aacf36922cce595f47baeae847007",
      "producerClass": "synthetic-calibration",
      "authorityClass": "proposal-only"
    }
  ],
  "inputSetCanonicalSha256": "868b961ee1343fb11f183ba4fb5c0c2c975cf608f00f427a7e5cca406e024868",
  "outputBindings": [
    {
      "ordinal": 1,
      "artifactId": "SE-E2E-THIN-01-ZERO-001-O3",
      "role": "implementation-tree",
      "mediaType": "application/json",
      "relativePath": "RAW-ARTIFACTS/SE-E2E-THIN-01-ZERO-001-O3.json",
      "byteLength": 1274,
      "byteSha256": "1c7eb832e0cfece461039bd68682bb3b59c3fba1dc386f2eb99000141b6c9823",
      "canonicalJsonSha256": "d31710ce30b5db6c04b33b8898f08db5dafe76cb4ed4b4d19d3dddfc0d14b724",
      "producerClass": "synthetic-calibration",
      "authorityClass": "proposal-only"
    }
  ],
  "outputSetCanonicalSha256": "5595aa500c80f862cc1fcd8bed9978951f7d71555acdaa2d90d27c9b19de5de1",
  "sections": [
    "orderedRedGreenRefactorTimeline",
    "publicBehaviorEvidence",
    "hiddenOracleResult",
    "mutantKillResult",
    "changedFileScope",
    "implementationAssumptions",
    "unresolvedItems",
    "nextGate"
  ],
  "provenanceIds": [
    "source.lifecycle-fixture"
  ],
  "assumptionIds": [],
  "detectedLossIds": [],
  "acceptanceObligationIds": [
    "acceptance.implementation-tdd"
  ],
  "humanAuthorityReceiptBindings": [
    "64f7aef81e2a52cf308427cfb18573a901b559e4ddcffecf3aef4e40a1ea3999",
    "4ea562583f50af1eed5601589238abf4d3659df7523e2ea5be68a191f3dacb2b"
  ],
  "repositoryTruthBefore": {
    "required": false,
    "observed": false,
    "snapshotArtifactId": null,
    "snapshotSha256": null,
    "provesFilesystemZeroWrite": false
  },
  "repositoryTruthAfter": {
    "required": false,
    "observed": false,
    "snapshotArtifactId": null,
    "snapshotSha256": null,
    "provesFilesystemZeroWrite": false
  },
  "allowedMutableFiles": [
    "feature.py",
    "test_feature.py"
  ],
  "changedFiles": [],
  "rawEventArtifactIds": [],
  "absoluteGateResults": [
    {
      "gateId": "mechanism.implementation-tdd",
      "passed": true,
      "evidenceArtifactIds": [
        "SE-E2E-THIN-01-ZERO-001-O3"
      ]
    }
  ],
  "truthTransition": {
    "proposalArtifactCanonicalSha256": "d31710ce30b5db6c04b33b8898f08db5dafe76cb4ed4b4d19d3dddfc0d14b724",
    "proposedChangeIds": [],
    "acceptedChangeIds": [],
    "rejectedChangeIds": [],
    "basisKindsUsed": [],
    "beforeAcceptedLedgerSha256": "0ee089542efe57115c0e1789c8222d83df6b2c0f18d0d74a4f222e302c13ac61",
    "afterAcceptedLedgerSha256": "821f3063600755f95791c9206badadb77660f54633a41af00e9f0bb9584028ef"
  },
  "parentEvaluation": {
    "evaluatorId": "software-lifecycle-zero-model-calibrator-v1",
    "evaluatorCanonicalSha256": "e9880346f79e8aeab22bbee4fc19173abc9ab4f2bfad270b492d828fa0ae2e6b",
    "stageValidators": [
      "parent-observed-valid-red-before-production-mutation",
      "visible-hidden-oracle",
      "predeclared-mutants",
      "changed-file-allowlist",
      "effective-sandbox",
      "private-oracle-nonexposure"
    ],
    "status": "accepted",
    "failureCodes": []
  },
  "execution": {
    "mode": "zero-model-scripted-calibration",
    "agentDispatchCount": 0,
    "modelCallCount": 0,
    "actualRouteObserved": false,
    "networkAccessUsed": false,
    "gitMutationUsed": false,
    "externalWriteUsed": false
  },
  "status": "accepted",
  "stopReason": null,
  "nextGate": null,
  "claimBoundary": {
    "liveAgentBehaviorProved": false,
    "productionLifecycleProved": false,
    "humanDecisionQualityProved": false,
    "crossHostPortabilityProved": false
  },
  "envelopeSha256": "083b49e8e8a1914464b392f90615291ff442ee634b6163907920eaaf18f5c5b7"
}
